ID;en-de;de-de;tr-de;en-nz;en-es;es-es;en-it;it-it;..;..;..;..;..;..
FC811;Please check the wiring of your telephone socket and the DSL-connector of your EasyBox.;Überprüfen Sie bitte die Verkabelung zwischen der Telefondose und der DSL-Buchse an ihrer EasyBox.;Lütfen EasyBox DSL-soketi ve Telefon kutusunun arasındaki kablolama kontrol edin.;Please check the wiring of your telephone socket and the DSL-connector of your EasyBox.;Please check the wiring of your telephone socket and the DSL-connector of your router.;Por favor, compruebe el cableado entre la roseta telefónica y el conector DSL de su router.;Please check the wiring of your telephone socket and the DSL-connector of your EasyBox.;;Überprüfen Sie bitte die Verkabelung zwischen der Telefondose und der DSL-Buchse an ihrer EasyBox.;Please check the wiring of your telephone socket and the DSL-connector of your EasyBox.;Lütfen EasyBox DSL-soketi ve Telefon kutusunun arasındaki kablolama kontrol edin.;;;Please check the wiring of your telephone socket and the DSL-connector of your EasyBox.
FC812;Please check the wiring of your telephone socket and the DSL-connector of your EasyBox.;Überprüfen Sie bitte die Verkabelung zwischen der Telefondose und der DSL-Buchse an ihrer EasyBox.;Lütfen EasyBox DSL-soketi ve Telefon kutusunun arasındaki kablolama kontrol edin.;Please check the wireing of your telephone socket and the DSL-connector of your EasyBox.;Please check the wireing of your telephone socket and the DSL-connector of your router.;Por favor, compruebe el cableado entre la roseta telefónica y el conector DSL de su router.;Please check the wireing of your telephone socket and the DSL-connector of your EasyBox.;;Überprüfen Sie bitte die Verkabelung zwischen der Telefondose und der DSL-Buchse an ihrer EasyBox.;Please check the wiring of your telephone socket and the DSL-connector of your EasyBox.;Lütfen EasyBox DSL-soketi ve Telefon kutusunun arasındaki kablolama kontrol edin.;;;Please check the wiring of your telephone socket and the DSL-connector of your EasyBox.
FC813;No connection to the telephone network available now.;Die Verbindung zum Telefon-Netz ist momentan nicht möglich.;Telefon hattına baglantı kurulanmıyor.;No connection to the telephone network available now.;No connection to the telephone network available now.;Su router no ha podido conectarse a la red de telefonía. ;No connection to the telephone network available now.;;Die Verbindung zum Telefon-Netz ist momentan nicht möglich.;No connection to the telephone network available now.;Telefon hattına baglantı kurulanmıyor.;;;No connection to the telephone network available now.
FC814;No connection to the Internet network available right now.;Die Verbindung ins Internet ist momentan nicht möglich.;Internete baglantı kurulanmıyor.;No connection to the Internet network available right now.;No connection to the Internet network available right now.;Su router no ha podido conectarse a Internet.;No connection to the Internet network available right now.;;Die Verbindung ins Internet ist momentan nicht möglich.;No connection to the Internet network available right now.;Internete baglantı kurulanmıyor.;;;No connection to the Internet network available right now.
FC815;No connection to the telephone network available now.;Die Verbindung zum Telefon-Netz ist momentan nicht möglich.;Telefon hattına baglantı kurulanmıyor.;No connection to the telephone network available now.;No connection to the telephone network available now.;Su router no ha podido conectarse a la red de telefonía. ;No connection to the telephone network available now.;;Die Verbindung zum Telefon-Netz ist momentan nicht möglich.;No connection to the telephone network available now.;Telefon hattına baglantı kurulanmıyor.;;;No connection to the telephone network available now.
FC816;The internet connection is severly disrupted. Please check the wiring to the grey DSL connector of your EasyBox for other electronic devices interference or loose contacts.;Die Übertragung ins Internet ist erheblich gestört. Bitte kontrollieren Sie die Verkabelung bis zur grauen DSL-Buchse der EasyBox, zum Beispiel auf störende Elektrogeräte oder Wackelkontakte.;Internet baglantısı arzalı. Başka elektronik cihazlar veya gevşek bağlantılar neden olabilir. Lütfen EasyBox gri DSL-soketi arasındaki kabloyu kontrol edin.;The internet connection is severly disrupted. Please check the wiring to the grey DSL connector of your EasyBox for other electronic devices interference or loose contacts.;The internet connection is severly disrupted. Please check the wiring to the grey DSL connector of your router for other electronic devices interference or loose contacts.;Conexión a Internet fallida. Por favor, compruebe el cableado entre el conector DSL gris de su router.contacts.;The internet connection is severly disrupted. Please check the wiring to the grey DSL connector of your EasyBox for other electronic devices interference or loose contacts.;;Die Übertragung ins Internet ist erheblich gestört. Bitte kontrollieren Sie die Verkabelung bis zur grauen DSL-Buchse der EasyBox, zum Beispiel auf störende Elektrogeräte oder Wackelkontakte.;The internet connection is severly disrupted. Please check the wiring to the grey DSL connector of your EasyBox for other electronic devices interference or loose contacts.;Internet baglantısı arzalı. Başka elektronik cihazlar veya gevşek bağlantılar neden olabilir. Lütfen EasyBox gri DSL-soketi arasındaki kabloyu kontrol edin.;;;The internet connection is severly disrupted. Please check the wiring to the grey DSL connector of your EasyBox for other electronic devices interference or loose contacts.
FC817;Connection inoperable.;Der Anschluß ist momentan nicht betriebsbereit.;Hattınız şu anda işlevsel değil.;Connection inoperable.;Connection inoperable.;Conexión fallida;Connection inoperable.;;Der Anschluß ist momentan nicht betriebsbereit.;Connection inoperable.;Hattınız şu anda işlevsel değil.;;;Connection inoperable.
FC818;No connection to the service provider available. Possibly you are using the EasyBox at a different connection.;Es kann keine Verbindung zum Netzbetreiber aufgebaut werden. Möglicherweise verwenden Sie die EasyBox an einem fremden Anschluss.;Hattınız şu anda operatörünize bağlı değil. EasyBox´u yanlış bir hatta kullanıyor olabilirsiniz.;No connection to the service provider available. Possibly you are using the EasyBox at a different connection.;No connection to the service provider available. Possibly you are using the router at a different connection.;Sin conexión a Internet.;No connection to the service provider available. Possibly you are using the EasyBox at a different connection.;;Es kann keine Verbindung zum Netzbetreiber aufgebaut werden. Möglicherweise verwenden Sie die EasyBox an einem fremden Anschluss.;No connection to the service provider available. Possibly you are using the EasyBox at a different connection.;Hattınız şu anda operatörünize bağlı değil. EasyBox´u yanlış bir hatta kullanıyor olabilirsiniz.;;;No connection to the service provider available. Possibly you are using the EasyBox at a different connection.
FC851;No connection to the Vodafone TV service available. Please switch off your EasyBox for 3 minutes before switching it on again.;Die Verbindungzum Vodafonel TV ist momentan nicht möglich. Bitte trennen Sie Ihre EasyBox für 3 Minuten vom Netzteil.;Vodafone TV´ya baglantı kurulanmıyor. Lütfen EasyBox´u 3 dakkika kapatın.;No connection to the Vodafone TV service available. Please switch off your EasyBox for 3 minutes before switching it on again.;No connection to the Vodafone TV service available. Please switch off your router for 3 minutes before switching it on again.;Sin conexion al servicio de Vodafone TV.  Por favor, apagué el router y vuelva a encenderlo.;No connection to the Vodafone TV service available. Please switch off your EasyBox for 3 minutes before switching it on again.;;Die Verbindung zum Vodafone TV ist momentan nicht möglich. Bitte trennen Sie Ihre EasyBox für 3 Minuten vom Netzteil.;No connection to the Vodafone TV service available. Please switch off your EasyBox for 3 minutes before switching it on again.;Vodafone TV´ya baglantı kurulanmıyor. Lütfen EasyBox´u 3 dakkika kapatın.;;;No connection to the Vodafone TV service available. Please switch off your EasyBox for 3 minutes before switching it on again.
;;;;;No DSL link detected.;Enalce DSL no detectado.;;;;;;;;
;;;;;DSL link is not stable, more than 3 times cuts in one day.;Enlace DSL no estable, más de 3 cortes en un día.;;;;;;;;
;;;;;DSL link is not good, too many CRC errors.;Enlace DSL no es bueno, muchos errores CRC.;;;;;;;;
;;;;;No Fibra link.;No hay enlace de fibra.;;;;;;;;
;;;;;Can't ping through gateway.;No es posible hacer ping a través del gateway.;;;;;;;;
;;;;;DNS lookup failed.;Busqueda de DNS fallida;;;;;;;;
;;;;;Uplink congested.;Uplink congestionado.;;;;;;;;
;;;;;No traffic from Downlink.;No hay tráfico en Downlink.;;;;;;;;
;;;;;Telephone is not active.;Teléfono no activo.;;;;;;;;
;;;;;Telephone registration failed.;Registro del teléfono fallido.;;;;;;;;
;;;;;WiFi authentication failed, probably password is not right. ;Autenticación WiFi fallida, probablemente la contraseña no es correcta.;;;;;;;;
;;;;;WiFi  is not good.;La señal WiFi no es buena.;;;;;;;;
;;;;;LAN1 link maybe broken, no packets received.;El puerto LAN1 puede estar dañado, no se han recibido paquetes.;;;;;;;;
;;;;;LAN1 link maybe congested, drop too many packets.;El puerto LAN1 puede estar congestionado. Se han descartado muchos paquetes.;;;;;;;;
;;;;;LAN2 link maybe broken, no packets received.;El puerto LAN2 puede estar dañado, no se han recibido paquetes.;;;;;;;;
;;;;;LAN2 link maybe congested, drop too many packets.;El puerto LAN2 puede estar congestionado. Se han descartado muchos paquetes.;;;;;;;;
;;;;;LAN3 link maybe broken, no packets received.;El puerto LAN3 puede estar dañado, no se han recibido paquetes.;;;;;;;;
;;;;;LAN3 link maybe congested, drop too many packets.;El puerto LAN3 puede estar congestionado. Se han descartado muchos paquetes.;;;;;;;;
;;;;;LAN4 link maybe broken, no packets received.;El puerto LAN4 puede estar dañado, no se han recibido paquetes.;;;;;;;;
;;;;;LAN4 link maybe congested, drop too many packets.;El puerto LAN4 puede estar congestionado. Se han descartado muchos paquetes.;;;;;;;;
;;;;;Can't connect to ACS server last time.;No se pudo conectar al servidor ACS la última vez.;;;;;;;;
;;;;;Free memory  is too low.;Memoria libre muy baja.;;;;;;;;
;;;;;Current CPU utilization is too high, more than 80% has been taken up.;El uso actual de la CPU es muy alto, más del 80% en uso.;;;;;;;;
;;;;;No UMTS link detected.;No se ha detectado enlace UMTS.;;;;;;;;
